{
  "claim_id": "C1-one-shot-fault-contract",
  "run_id": "fault-synthetic-v1",
  "artifact_hashes": {
    "studies/arxiv-2610.10062/evidence/fault_synthetic_v1.result.json": "sha256:3e1e7f699b83508aa627af1a80c18e4f3bce0f7076997941c8256c3b1e3de3a8"
  },
  "metrics": {
    "trials": 15,
    "fired": 12,
    "loud_detected": 9,
    "loud_total": 9,
    "quiet_detected": 1,
    "quiet_total": 3,
    "recovered": 12,
    "local_pytest_passed": 4
  },
  "verdict": "PASS",
  "notes": "Only independent scripted synthetic mechanism. No LLM behavior or BFCL paper benchmark. Evidence output generated by executed local script; test fixtures are now frozen."
}
