{
  "claim_id": "C3-protocol-shape",
  "run_id": "focus-provider-neutral-protocol-v1",
  "artifact_hashes": {},
  "metrics": {
    "checks": 7,
    "passed": 7,
    "pass_rate": 1
  },
  "verdict": "PASS",
  "notes": "Provider-neutral protocol harness verifies memory-budget trigger semantics, N=3 draft calls, temperature/seed propagation, strict citation parsing, tau=0.3 utility selection, and defensive rescue union. Scripted draft outputs mean this is protocol-shape evidence only."
}
