{
  "artifact_hashes": {
    "fixture_sha256": "bbad791c25860041936715cc3476fb6fc09e15413f33823ca45f7ab089b8c663",
    "implementation_sha256": "58458b5b2d3889f776de720cbdb9b379fa81a572b3813034f1a46f0e9737e180",
    "runner_sha256": "2ad8545dbd1826915773489736aa39a5d07dffefc64a2fdc8131617118c88ee5"
  },
  "claim_id": "C4-loss-aggregation",
  "metrics": {
    "checks": {
      "padding_invariant": true,
      "per_sample_mean_then_batch_mean": true,
      "token_pooled_value_would_be": 0.0060248839495871485
    }
  },
  "notes": "Masked per-sample token mean followed by batch mean; padding-invariant.",
  "run_id": "opst-mechanism-v1",
  "verdict": "PASS"
}
