{
  "claim_id": "C1-model-independent-choice-contract",
  "run_id": "graphdecide-mechanism-v1",
  "artifact_hashes": {
    "graphdecide_mechanism.py": "git-blob:30521245734f8d5c843152420cee2f2e4f771734",
    "graphdecide_synthetic_spec.json": "git-blob:60522b8d1582fb17a89c5fbe976ddf299c59a3a7",
    "run_graphdecide_mechanism.py": "git-blob:29e8b7beb6e1382cf92eec210d6d44a179fb2260",
    "test_graphdecide_mechanism.py": "git-blob:674dee868152ee3e5d6297662ecbd2da47a7e89e"
  },
  "metrics": {
    "rq1_tasks": 6,
    "invalid_choice_rejected": true,
    "unsupported_choice_separate": true,
    "sequential_complete": 1,
    "sequential_failed": 1,
    "coverage": 0.5,
    "failed_gap_is_null": true
  },
  "verdict": "PARTIAL",
  "notes": "Independent synthetic evidence verifies the evaluator/model separation, candidate-space enforcement, unsupported-vs-invalid distinction, and evaluator-owned sequential state transition. It does not reproduce the paper's public datasets or model results."
}
