{
  "claim_id": "C1-task-tool-relevance",
  "run_id": "semantic-crossencoder-calibrated-v1",
  "artifact_hashes": {},
  "metrics": {
    "test_case_count": 16,
    "test_accuracy": 0.375,
    "test_precision": 0.36363636363636365,
    "test_recall": 0.5714285714285714,
    "test_f1": 0.4444444444444444,
    "test_false_positive_rate": 0.7777777777777778,
    "test_false_negative_rate": 0.42857142857142855,
    "paper_accuracy_target": 0.95,
    "paper_f1_target": 0.95
  },
  "verdict": "PARTIAL",
  "notes": "Independent off-the-shelf MiniLM CrossEncoder experiment. Threshold was calibrated on the first 16 synthetic cases and evaluated on the remaining 16. The semantic baseline did not meet the paper target and did not reproduce Gemma 3 / GEPA / SFT / GRPO."
}
