{
  "claim_id": "C3-action-only-preference-loss",
  "run_id": "had-real-teacher-pair-multiseed-v1",
  "artifact_hashes": {
    "distill-101": "sha256:9459db9d486af9f7e3ae70a07f8e98c51d38c25a1042e9421aa0c2d5298a0e7b",
    "distill-202": "sha256:8b1666283d59c49c82ad92c8d2c6fdb87cb6e2ced9b51a05deb2d1d43fe1b723",
    "distill-303": "sha256:dedcd2e9bf22bc0917ac2e33eebdeeb271c8551706cf5fe3febeb51a6ed6036a",
    "had-101": "sha256:889bd76dbf4171cb776476c814b6c5f720d27131e5fc4de3b6202487ab3ffef9",
    "had-202": "sha256:f05ab585121018978026f29e713ecd22dc217ecb08c1da22e7aac1bcf4033f3f",
    "had-303": "sha256:bbb45e0211e84a248ab0792a22e053a0d276bdda51c131512c6f6d5b4a2608a5"
  },
  "metrics": {
    "seeds": 3,
    "runs": 6,
    "heldout_examples": 4,
    "after_accuracy_had": 0.5,
    "after_accuracy_distill_only": 0.5,
    "had_mean_margin_change": 0.026891107360521953,
    "distill_only_mean_margin_change": 0.02359236280123393,
    "mean_margin_change_difference": 0.003298744559288025,
    "seeds_had_exceeded_distill": 3
  },
  "verdict": "PARTIAL",
  "notes": "Real Qwen2.5-0.5B LoRA training using two active valid preference pairs generated by the same Qwen2.5-1.5B teacher contrast. On four frozen unseen synthetic harness states, accuracy remained unchanged at 50% in every run, while HAD yielded a slightly larger mean-margin improvement than distillation-only in all three seeds. No efficacy or paper-level benchmark claim is made."
}
